{"outcome":"in-review","summary":"PRD 详情抽屉支持检测并查看对应 worktree 的 autopilot 结果 log：存在时显示“Result log”按钮/页签并在界面中加载展示。","blockers":[],"validation":[{"command":"npm test","ok":true,"notes":"pass"},{"command":"npm run build","ok":true,"notes":"vite build ok"},{"command":"npx tsc -p tsconfig.json --noEmit","ok":true,"notes":"typecheck ok"}],"files_changed":["vite.config.ts","src/components/CardPreviewDrawer.tsx"],"commit":{"created":false,"message":""},"notes":"新增内部 API `GET /__prd/api/result-log`（json 检查存在性、text 读取，超过 1MB 自动截断尾部）；CardPreviewDrawer 在查看详情时自动探测 log 并提供“Result log”页签查看/Reload。"}