{"outcome":"in-review","summary":"Added `prd project list` command and updated the card-creation component prompt to show numbered options while still accepting custom component input.","blockers":[],"validation":[{"command":"npm test","ok":true,"notes":"node --test tests (23/23 passed)"}],"files_changed":["README.md","bin/prd.mjs","scripts/prd_cards.mjs","tests/prdCardsCli.test.mjs","tests/prdCli.test.mjs"],"commit":{"created":false,"message":""},"notes":"New command: `prd project list [--hub <path>] [--json]` (lists Project→Repo mappings from `<hub>/AGENT.md`). Component prompt now offers numbered suggestions (ui/api + discovered from existing cards) and also accepts any typed custom component string."}