{"outcome":"in-review","summary":"在 Dashboard 的卡片侧边栏新增 Logs 视图：按 thinking/exec/tool 分块显示并对 diff/patch 行做高亮，支持 Wrap 切换；同时新增本地 API 读取对应 worktree 的 autopilot 日志文件。","blockers":[],"validation":[{"command":"npm test","ok":true,"notes":"node --test：19 tests passed"},{"command":"npm run build","ok":true,"notes":"vite build succeeded"}],"files_changed":["vite.config.ts","src/components/CardPreviewDrawer.tsx","src/components/LogViewer.tsx"],"commit":{"created":false,"message":""},"notes":"使用方式：打开卡片侧边栏后切换到 `Logs`；日志通过 `GET /__prd/api/log?project=<project>&cardId=<id>` 读取，并以编辑器风格（不强制换行、可横向滚动、diff/patch 颜色提示）渲染。"}